{
  "schemaVersion": "programmable.open-review-input.v1",
  "reviewedRevision": {
    "numericRepositoryId": 1003,
    "repository": "example/proven-diversion",
    "commit": "aaaaaaaaaaaaaaaaaaaaaaaaaaaaaaaaaaaaaaaa",
    "tree": "bbbbbbbbbbbbbbbbbbbbbbbbbbbbbbbbbbbbbbbb",
    "configurationHash": "sha256:cccccccccccccccccccccccccccccccccccccccccccccccccccccccccccccccc"
  },
  "currentRevision": {
    "numericRepositoryId": 1003,
    "repository": "example/proven-diversion",
    "commit": "aaaaaaaaaaaaaaaaaaaaaaaaaaaaaaaaaaaaaaaa",
    "tree": "bbbbbbbbbbbbbbbbbbbbbbbbbbbbbbbbbbbbbbbb",
    "configurationHash": "sha256:cccccccccccccccccccccccccccccccccccccccccccccccccccccccccccccccc"
  },
  "obligations": [
    { "id": "artifact.identity", "axis": "artifact_identity", "critical": true, "owner": "candidate", "state": "closed", "statement": "Exact source and runtime identity are bound.", "evidence": ["sha256:1111111111111111111111111111111111111111111111111111111111111111"] },
    { "id": "functionality.swap", "axis": "functionality", "critical": true, "owner": "candidate", "state": "closed", "statement": "The reachable swap path is reproduced.", "evidence": ["sha256:2222222222222222222222222222222222222222222222222222222222222222"] },
    { "id": "disclosure.behavior", "axis": "disclosure", "critical": true, "owner": "candidate", "state": "closed", "statement": "The submitted disclosure is bound to the reviewed revision.", "evidence": ["sha256:3333333333333333333333333333333333333333333333333333333333333333"] },
    { "id": "integrity.value-flow", "axis": "integrity", "critical": true, "owner": "platform", "state": "contradicted", "statement": "An independently replayed path diverts input without the declared output.", "evidence": ["sha256:4444444444444444444444444444444444444444444444444444444444444444"] },
    { "id": "launch.compatibility", "axis": "launch_compatibility", "critical": true, "owner": "candidate", "state": "closed", "statement": "The configuration is syntactically launch-compatible.", "evidence": ["sha256:5555555555555555555555555555555555555555555555555555555555555555"] }
  ],
  "witnesses": [
    {
      "ruleId": "UNAUTHORIZED_VALUE_DIVERSION",
      "universal": true,
      "revisionBound": true,
      "reachable": true,
      "complete": true,
      "independentlyReplayed": true,
      "sequenceHash": "sha256:6666666666666666666666666666666666666666666666666666666666666666",
      "affectedActors": "A swapping user",
      "affectedValue": "The full exact-input amount",
      "violatedProperty": "Every consented input must receive the declared output or a declared loss.",
      "reproduction": "Execute the bound exact-input path twice in independent runners and compare terminal wallet deltas."
    }
  ]
}
